Z99.1,Dependência de Respirador
A01.2,Febre Paratifóide B
A02.2,Infecções Localizadas Por Salmonela
A03.2,Shiguelose Devida a Shigella Boydii
A04.2,Infecção Por Escherichia Coli Enteroinvasiva
A05.2,Intoxicação Alimentar Devida a Clostridium Perfringens (Clostridium Welchii)
A06.2,Colite Amebiana Não-disentérica
A07.2,Criptosporidiose
A08.2,Enterite Por Adenovírus
A15.2,"Tuberculose Pulmonar, Com Confirmação Histológica"
A16.2,"Tuberculose Pulmonar, Sem Menção de Confirmação Bacteriológica ou Histológica"
A18.2,Linfadenopatia Tuberculosa Periférica
A19.2,Tuberculose Miliar Aguda Não Especificada
A20.2,Peste Pneumônica
A21.2,Tularemia Pulmonar
A22.2,Carbúnculo Gastrointestinal
A23.2,Brucelose Por Brucella Suis
A24.2,Melioidose Subaguda e Crônica
A28.2,Yersiniose Extra-intestinal
A30.2,Hanseníase (lepra) Tuberculóide Borderline
A36.2,Difteria Laríngea
A39.2,Meningococcemia Aguda
A40.2,Septicemia Por Streptococcus do Grupo D
A41.2,Septicemia Por Estafilococos Não Especificados
A42.2,Actinomicose Cervicofacial
A48.2,Doença Dos Legionários Não-pneumônica (febre de Pontiac)
A49.2,Infecção Por Haemophilus Influenzae de Localização Não Especificada
A50.2,Sífilis Congênita Precoce Não Especificada
A51.2,Sífilis Primária de Outras Localizações
A52.2,Neurossífilis Assintomática
A54.2,Pelviperitonite Gonocócica e Outras Infecções Geniturinárias Gonocócicas
A56.2,"Infecção Por Clamídias do Trato Geniturinário, Localização Não Especificada"
A66.2,Outras Lesões Cutâneas Precoces da Bouba
A67.2,Lesões Tardias da Pinta
A69.2,Doença de Lyme
A75.2,Tifo Por Rickettsia Typhi
A77.2,Febre Maculosa Devida à Rickettsia Siberica
A80.2,"Poliomielite Paralítica Aguda, Vírus Selvagem Indígena"
A81.2,Leucoencefalopatia Multifocal Progressiva
A83.2,Encefalite Eqüina Oriental
A85.2,"Encefalite Por Vírus Transmitido Por Artrópodes, Não Especificada"
A87.2,Coriomeningite Linfocitária
A92.2,Febre Eqüina Venezuelana
A93.2,Febre do Colorado Transmitida Por Carrapatos
A96.2,Febre de Lassa
A98.2,Doença da Floresta de Kyasanur
B00.2,Gengivoestomatite e Faringoamigdalite Devida ao Vírus do Herpes
B01.2,Pneumopatia Varicelosa
B02.2,Herpes Zoster Acompanhado de Outras Manifestações Neurológicas
B05.2,Sarampo Complicado Por Pneumonia
B08.2,Exantema Súbito (sexta Doença)
B16.2,"Hepatite Aguda B Sem Agente Delta, Com Coma Hepático"
B17.2,Hepatite Aguda E
B18.2,Hepatite Viral Crônica C
B20.2,Doença Pelo HIV Resultando em Doença Citomegálica
B21.2,Doença Pelo HIV Resultando em Outros Tipos de Linfoma Não-Hodgkin
B22.2,Doença Pelo HIV Resultando em Síndrome de Emaciação
B23.2,Doença Pelo HIV Resultando em Anomalias Hematológicas e Imunológicas Não Classificadas em Outra Parte
B25.2,Pancreatite Por Citomegalovírus
B26.2,Encefalite Por Caxumba (parotidite Epidêmica)
B30.2,Faringoconjuntivite Viral
B33.2,Cardite Viral
B34.2,Infecção Por Coronavírus de Localização Não Especificada
B35.2,Tinha da Mão
B36.2,Piedra Branca
B37.2,Candidíase da Pele e Das Unhas
B38.2,Coccidioidomicose Pulmonar Não Especificada
B39.2,Histoplasmose Pulmonar Não Especificada Por Histoplasma Capsulatum
B40.2,Blastomicose Pulmonar Não Especificada
B43.2,Abscesso e Cisto Feomicótico Subcutâneos
B44.2,Aspergilose Amigdaliana
B45.2,Criptococose Cutânea
B46.2,Mucormicose Gastrointestinal
B48.2,Alesqueriose
B55.2,Leishmaniose Cutâneo-mucosa
B57.2,Doença de Chagas (crônica) Com Comprometimento Cardíaco
B58.2,Meningoencefalite Por Toxoplasma
B60.2,Naegleríase
B65.2,Esquistossomose Devida ao Schistosoma Japonicum
B66.2,Dicrocelíase
B67.2,Infestação Óssea Por Echinococcus Granulosus
B74.2,Filariose Por Brugia Timori
B81.2,Tricostrongilose
B83.2,Angrostrongilíase Devida a Parastrongylus Cantonensis
B85.2,Pediculose Não Especificada
B87.2,Miíase Ocular
B88.2,Outras Infestações Por Artrópodos
B90.2,Seqüelas de Tuberculose Óssea e Das Articulações
B94.2,Seqüelas de Hepatite Viral
B95.2,"Estreptococo do Grupo D, Como Causa de Doenças Classificadas em Outros Capítulos"
B96.2,"Escherichia Coli (E. Coli), Como Causa de Doenças Classificadas em Outros Capítulos"
B97.2,"Coronavírus, Como Causa de Doenças Classificadas em Outros Capítulos"
C00.2,"Neoplasia Maligna do Lábio Externo, Não Especificado"
C02.2,Neoplasia Maligna da Face Ventral da Língua
C05.2,Neoplasia Maligna da Úvula
C06.2,Neoplasia Maligna da Área Retromolar
C10.2,Neoplasia Maligna da Parede Lateral da Orofaringe
C11.2,Neoplasia Maligna da Parede Lateral da Nasofaringe
C13.2,Neoplasia Maligna da Parede Posterior da Hipofaringe
C14.2,Neoplasia Maligna do Anel de Waldeyer
C15.2,Neoplasia Maligna da Porção Abdominal do Esôfago (esôfago Abdominal)
C16.2,Neoplasia Maligna do Corpo do Estômago
C17.2,Neoplasia Maligna do Íleo
C18.2,Neoplasia Maligna do Cólon Ascendente
C21.2,Neoplasia Maligna da Zona Cloacogênica
C22.2,Hepatoblastoma
C25.2,Neoplasia Maligna da Cauda do Pâncreas
C31.2,Neoplasia Maligna do Seio Frontal
C32.2,Neoplasia Maligna da Região Subglótica
C34.2,"Neoplasia Maligna do Lobo Médio, Brônquio ou Pulmão"
C38.2,Neoplasia Maligna do Mediastino Posterior
C40.2,Neoplasia Maligna Dos Ossos Longos Dos Membros Inferiores
C41.2,Neoplasia Maligna da Coluna Vertebral
C43.2,Melanoma Maligno da Orelha e do Conduto Auditivo Externo
C44.2,Neoplasia Maligna da Pele da Orelha e do Conduto Auditivo Externo
C45.2,Mesotelioma do Pericárdio
C46.2,Sarcoma de Kaposi do Palato
C47.2,"Neoplasia Maligna Dos Nervos Periféricos Dos Membros Inferiores, Incluindo Quadril"
C48.2,Neoplasia Maligna do Peritônio
C49.2,"Neoplasia Maligna do Tecido Conjuntivo e Tecidos Moles Dos Membros Inferiores, Incluindo Quadril"
C50.2,Neoplasia Maligna do Quadrante Superior Interno da Mama
C51.2,Neoplasia Maligna do Clitóris
C54.2,Neoplasia Maligna do Miométrio
C57.2,Neoplasia Maligna do Ligamento Redondo
C60.2,Neoplasia Maligna do Corpo do Pênis
C63.2,Neoplasia Maligna do Escroto
C67.2,Neoplasia Maligna da Parede Lateral da Bexiga
C69.2,Neoplasia Maligna da Retina
C71.2,Neoplasia Maligna do Lobo Temporal
C72.2,Neoplasia Maligna do Nervo Olfativo
C75.2,Neoplasia Maligna do Conduto Craniofaríngeo
C76.2,Neoplasia Maligna do Abdome
C77.2,Neoplasia Maligna Secundária e Não Especificada Dos Gânglios Linfáticos Intra-abdominais
C78.2,Neoplasia Maligna Secundária da Pleura
C79.2,Neoplasia Maligna Secundária da Pele
C81.2,"Doença de Hodgkin, Celularidade Mista"
C82.2,"Linfoma Não-Hodgkin, Grandes Células, Folicular"
C83.2,"Linfoma Não-Hodgkin Difuso, Misto, de Pequenas e Grandes Células (difuso)"
C84.2,Linfoma da Zona T
C88.2,Doença de Cadeia Pesada Gama
C90.2,Plasmocitoma Extramedular
C91.2,Leucemia Linfocítica Subaguda
C92.2,Leucemia Mielóide Subaguda
C93.2,Leucemia Monocítica Subaguda
C94.2,Leucemia Megacarioblástica Aguda
C95.2,Leucemia Subaguda de Tipo Celular Não Especificado
C96.2,Tumor Maligno de Mastócitos
D00.2,Carcinoma in Situ do Estômago
D01.2,Carcinoma in Situ do Reto
D02.2,Carcinoma in Situ Dos Brônquios e Pulmões
D03.2,Melanoma in Situ da Orelha e do Conduto Auditivo Externo
D04.2,Carcinoma in Situ da Pele da Orelha e do Conduto Auditivo Externo
D07.2,Carcinoma in Situ da Vagina
D09.2,Carcinoma in Situ do Olho
D10.2,Neoplasia Benigna do Assoalho da Boca
D12.2,Neoplasia Benigna do Cólon Ascendente
D13.2,Neoplasia Benigna do Duodeno
D14.2,Neoplasia Benigna da Traquéia
D15.2,Neoplasia Benigna do Mediastino
D16.2,Neoplasia Benigna Dos Ossos Longos Dos Membros Inferiores
D17.2,Neoplasia Lipomatosa Benigna da Pele e Tecido Subcutâneo Dos Membros
D21.2,"Neoplasia Benigna do Tecido Conjuntivo e Outros Tecidos Moles Dos Membros Inferiores, Incluindo Quadril"
D22.2,Nevo Melanocítico da Orelha e do Conduto Auditivo Externo
D23.2,Neoplasia Benigna da Pele da Orelha e do Conduto Auditivo Externo
D25.2,Leiomioma Subseroso do Útero
D28.2,Neoplasia Benigna Das Trompas e Ligamentos Uterinos
D29.2,Neoplasia Benigna Dos Testículos
D30.2,Neoplasia Benigna do Ureter
D31.2,Neoplasia Benigna da Retina
D33.2,"Neoplasia Benigna do Encéfalo, Não Especificado"
D35.2,Neoplasia Benigna da Glândula Hipófise (pituitária)
D37.2,Neoplasia de Comportamento Incerto ou Desconhecido do Intestino Delgado
D38.2,Neoplasia de Comportamento Incerto ou Desconhecido da Pleura
D39.2,Neoplasia de Comportamento Incerto ou Desconhecido da Placenta
D41.2,Neoplasia de Comportamento Incerto ou Desconhecido do Ureter
D43.2,"Neoplasia de Comportamento Incerto ou Desconhecido do Encéfalo, Não Especificado"
D44.2,Neoplasia de Comportamento Incerto ou Desconhecido da Glândula Paratireóide
D46.2,Anemia Refratária Com Excesso de Blastos
D47.2,Gamopatia Monoclonal
D48.2,Neoplasia de Comportamento Incerto ou Desconhecido Dos Nervos Periféricos e do Sistema Nervoso Periférico
D51.2,Deficiência de Transcobalamina II
D53.2,Anemia Escorbútica
D55.2,Anemia Devida a Transtornos Das Enzimas Glicolíticas
D56.2,Talassemia Delta-beta
D57.2,Transtornos Falciformes Heterozigóticos Duplos
D58.2,Outras Hemoglobinopatias
D59.2,Anemia Hemolítica Não-auto-imune Induzida Por Drogas
D61.2,Anemia Aplástica Devida a Outros Agentes Externos
D64.2,Anemia Sideroblástica Secundária ao Uso de Drogas e a Toxinas
D68.2,Deficiência Hereditária de Outros Fatores de Coagulação
D69.2,Outras Púrpuras Não-trombocitopênicas
D73.2,Esplenomegalia Congestiva Crônica
D75.2,Trombocitose Essencial
D76.2,Síndrome Hematofagocítica Associada à Infecção
D80.2,Deficiência Seletiva de Imunoglobulina A (IgA)
D81.2,Imunodeficiência Combinada Grave (SCID) Com Números Baixos ou Normais de Células B
D82.2,Imunodeficiência Com Encurtamento de Membros
D83.2,Imunodeficiência Comum Variável Com Auto-anticorpos às Células B ou T
D86.2,Sarcoidose do Pulmão Com Sarcoidose Dos Gânglios Linfáticos
D89.2,Hipergamaglobulinemia Não Especificada
E00.2,Síndrome da Deficiência Congênita de Iodo do Tipo Misto
E01.2,"Bócio (endêmico) Não Especificado, Por Deficiência de Iodo"
E03.2,Hipotireoidismo Devido a Medicamentos e Outras Substâncias Exógenas
E04.2,Bócio Não-tóxico Multinodular
E05.2,Tireotoxicose Com Bócio Tóxico Multinodular
E06.2,Tireoidite Crônica Com Tireotoxicose Transitória
E10.2,Diabetes Mellitus Insulino-dependente - Com Complicações Renais
E11.2,Diabetes Mellitus Não-insulino-dependente - Com Complicações Renais
E12.2,Diabetes Mellitus Relacionado Com a Desnutrição - Com Complicações Renais
E13.2,Outros Tipos Especificados de Diabetes Mellitus - Com Complicações Renais
E14.2,Diabetes Mellitus Não Especificado - Com Complicações Renais
E16.2,Hipoglicemia Não Especificada
E21.2,Outro Hiperparatireoidismo
E22.2,Síndrome da Secreção Inadequada de Hormônio Antidiurético
E23.2,Diabetes Insípido
E24.2,Síndrome de Cushing Induzida Por Droga
E27.2,Crise Addisoniana
E28.2,Síndrome do Ovário Policístico
E34.2,"Secreção Hormonal Ectópica, Não Classificada em Outra Parte"
E50.2,Deficiência de Vitamina A Com Xerose da Córnea
E51.2,Encefalopatia de Wernicke
E61.2,Deficiência de Magnésio
E64.2,Seqüelas da Deficiência de Vitamina C
E66.2,Obesidade Extrema Com Hipoventilação Alveolar
E67.2,Síndrome de Megavitamina B6
E70.2,Distúrbios do Metabolismo da Tirosina
E71.2,Distúrbio Não Especificado do Metabolismo de Aminoácidos de Cadeia Ramificada
E72.2,Distúrbios do Metabolismo do Ciclo da Uréia
E74.2,Distúrbios do Metabolismo da Galactose
E75.2,Outras Esfingolipidoses
E76.2,Outras Mucopolissacaridoses
E78.2,Hiperlipidemia Mista
E80.2,Outras Porfirias
E83.2,Distúrbios do Metabolismo do Zinco
E85.2,Amiloidose Heredofamiliar Não Especificada
E87.2,Acidose
E88.2,Lipomatose Não Classificada em Outra Parte
E89.2,Hipoparatireoidismo Pós-procedimento
F00.2,"Demência na Doença de Alzheimer, Forma Atípica ou Mista"
F01.2,Demência Vascular Subcortical
F02.2,Demência na Doença de Huntington
F06.2,Transtorno Delirante Orgânico (tipo Esquizofrênico)
F07.2,Síndrome Pós-traumática
F10.2,Transtornos Mentais e Comportamentais Devidos ao Uso de Álcool - Síndrome de Dependência
F11.2,Transtornos Mentais e Comportamentais Devidos ao Uso de Opiáceos - Síndrome de Dependência
F12.2,Transtornos Mentais e Comportamentais Devidos ao Uso de Canabinóides - Síndrome de Dependência
F13.2,Transtornos Mentais e Comportamentais Devidos ao Uso de Sedativos e Hipnóticos - Síndrome de Dependência
F14.2,Transtornos Mentais e Comportamentais Devidos ao Uso da Cocaína - Síndrome de Dependência
F15.2,"Transtornos Mentais e Comportamentais Devidos ao Uso de Outros Estimulantes, Inclusive a Cafeína - Síndrome de Dependência"
F16.2,Transtornos Mentais e Comportamentais Devidos ao Uso de Alucinógenos - Síndrome de Dependência
F17.2,Transtornos Mentais e Comportamentais Devidos ao Uso de Fumo - Síndrome de Dependência
F18.2,Transtornos Mentais e Comportamentais Devidos ao Uso de Solventes Voláteis - Síndrome de Dependência
F19.2,Transtornos Mentais e Comportamentais Devidos ao Uso de Múltiplas Drogas e ao Uso de Outras Substâncias Psicoativas - Síndrome de Dependência
F20.2,Esquizofrenia Catatônica
F23.2,Transtorno Psicótico Agudo de Tipo Esquizofrênico (schizophrenia-like)
F25.2,Transtorno Esquizoafetivo do Tipo Misto
F30.2,Mania Com Sintomas Psicóticos
F31.2,"Transtorno Afetivo Bipolar, Episódio Atual Maníaco Com Sintomas Psicóticos"
F32.2,Episódio Depressivo Grave Sem Sintomas Psicóticos
F33.2,"Transtorno Depressivo Recorrente, Episódio Atual Grave Sem Sintomas Psicóticos"
F40.2,Fobias Específicas (isoladas)
F41.2,Transtorno Misto Ansioso e Depressivo
F42.2,"Transtorno Obsessivo-compulsivo, Forma Mista, Com Idéias Obsessivas e Comportamentos Compulsivos"
F43.2,Transtornos de Adaptação
F44.2,Estupor Dissociativo
F45.2,Transtorno Hipocondríaco
F50.2,Bulimia Nervosa
F51.2,Transtorno do Ciclo Vigília-sono Devido a Fatores Não-orgânicos
F52.2,Falha de Resposta Genital
F60.2,Personalidade Dissocial
F63.2,Roubo Patológico (cleptomania)
F64.2,Transtorno de Identidade Sexual na Infância
F65.2,Exibicionismo
F66.2,Transtorno do Relacionamento Sexual
F80.2,Transtorno Receptivo da Linguagem
F81.2,Transtorno Específico da Habilidade em Aritmética
F84.2,Síndrome de Rett
F91.2,Distúrbio de Conduta do Tipo Socializado
F93.2,Distúrbio de Ansiedade Social da Infância
F94.2,"Transtorno de Fixação da Infância, Com Desinibição"
F95.2,Tiques Vocais e Motores Múltiplos Combinados (doença de Gilles de la Tourette)
F98.2,Transtorno de Alimentação na Infância
G00.2,Meningite Estreptocócica
G03.2,Meningite Recorrente Benigna (Mollaret)
G04.2,Meningoencefalite e Meningomielite Bacterianas Não Classificadas em Outra Parte
G05.2,"Encefalite, Mielite e Encefalomielite em Outras Doenças Infecciosas e Parasitárias Classificadas em Outra Parte"
G06.2,Abscesso Extradural e Subdural Não Especificados
G11.2,Ataxia Cerebelar de Início Tardio
G12.2,Doença do Neurônio Motor
G13.2,Atrofia Sistêmica Que Afeta Primariamente o Sistema Nervoso Central no Mixedema
G21.2,Parkinsonismo Secundário Devido a Outros Agentes Externos
G23.2,Degeneração Estrionígrica
G24.2,Distonia Não-familiar Idiopática
G25.2,Outras Formas Especificadas de Tremor
G31.2,Degeneração do Sistema Nervoso Devida ao Álcool
G37.2,Mielinólise Central da Ponte
G40.2,Epilepsia e Síndromes Epilépticas Sintomáticas Definidas Por Sua Localização (focal) (parcial) Com Crises Parciais Complexas
G41.2,Estado de Mal Epiléptico Parcial Complexo
G43.2,Estado de Mal Enxaquecoso
G44.2,Cefaléia Tensional
G45.2,"Síndrome Das Artérias Pré-cerebrais, Múltiplas e Bilaterais"
G46.2,Síndrome da Artéria Cerebral Posterior
G47.2,Distúrbios do Ciclo Vigília-sono
G51.2,Síndrome de Melkersson
G52.2,Transtornos do Nervo Vago
G53.2,Paralisias de Múltiplos Nervos Cranianos na Sarcoidose
G54.2,Transtornos Das Raízes Cervicais Não Classificadas em Outra Parte
G55.2,Compressões Das Raízes e Dos Plexos Nervosos na Espondilose
G56.2,Lesões do Nervo Cubital (ulnar)
G57.2,Lesão do Nervo Femoral
G60.2,Neuropatia Associada a Ataxia Hereditária
G62.2,Polineuropatia Devida a Outros Agentes Tóxicos
G63.2,Polineuropatia Diabética
G70.2,Miastenia Congênita e do Desenvolvimento
G71.2,Miopatias Congênitas
G72.2,Miopatia Devida a Outros Agentes Tóxicos
G73.2,Outras Síndromes Miastênicas em Doenças Neoplásicas
G80.2,Paralisia Cerebral Hemiplégica Espástica
G82.2,Paraplegia Não Especificada
G83.2,Monoplegia do Membro Superior
G90.2,Síndrome de Horner
G91.2,Hidrocefalia de Pressão Normal
G93.2,Hipertensão Intracraniana Benigna
G94.2,Hidrocefalia em Outras Doenças Classificadas em Outra Parte
G95.2,Compressão Não Especificada de Medula Espinal
G97.2,Hipotensão Intracraniana Conseqüente à Derivação Ventricular
G99.2,Mielopatia em Doenças Classificadas em Outra Parte
H02.2,Lagoftalmo
H04.2,Epífora
H05.2,Afecções Exoftálmicas
H06.2,Exoftalmo Distireoídeo
H10.2,Outras Conjuntivites Agudas
H11.2,Cicatrizes da Conjuntiva
H13.2,Conjuntivite em Outras Doenças Classificadas em Outra Parte
H16.2,Ceratoconjuntivite
H18.2,Outros Edemas da Córnea
H19.2,Ceratite e Ceratoconjuntivite em Outras Doenças Infecciosas e Parasitárias Classificadas em Outra Parte
H20.2,Iridociclite Induzida Pelo Cristalino
H21.2,Degenerações da Íris e do Corpo Ciliar
H25.2,Catarata Senil Tipo Morgagni
H26.2,Catarata Complicada
H28.2,Catarata em Outras Doenças Classificadas em Outra Parte
H30.2,Ciclite Posterior
H31.2,Distrofia Hereditária da Coróide
H33.2,Descolamento Seroso da Retina
H34.2,Outras Oclusões da Artéria Retiniana
H35.2,Outras Retinopatias Proliferativas
H40.2,Glaucoma Primário de Ângulo Fechado
H43.2,Depósitos Cristalinos no Humor Vítreo
H44.2,Miopia Degenerativa
H47.2,Atrofia Óptica
H49.2,Paralisia do Sexto Par (abducente)
H50.2,Estrabismo Vertical
H51.2,Oftalmoplegia Internuclear
H52.2,Astigmatismo
H53.2,Diplopia
H54.2,Visão Subnormal de Ambos os Olhos
H60.2,Otite Externa Maligna
H61.2,Cerume Impactado
H62.2,Otite Externa em Micoses
H65.2,Otite Média Serosa Crônica
H66.2,Otite Média Ático-antral Supurativa Crônica
H70.2,Petrosite
H72.2,Outras Perfurações Marginais da Membrana do Tímpano
H74.2,Descontinuidade e Deslocamento Dos Ossículos do Ouvido
H80.2,Otosclerose da Cóclea
H81.2,Neuronite Vestibular
H83.2,Disfunção do Labirinto
H90.2,Perda Não Especificada de Audição Devida a Transtorno de Condução
H91.2,Perda de Audição Súbita Idiopática
H92.2,Otorragia
H93.2,Outras Percepções Auditivas Anormais
I01.2,Miocardite Reumática Aguda
I05.2,Estenose Mitral Com Insuficiência
I06.2,Estenose Aórtica Reumática Com Insuficiência
I07.2,Estenose Tricúspide Com Insuficiência
I08.2,Transtornos de Ambas as Valvas Aórtica e Tricúspide
I09.2,Pericardite Reumática Crônica
I13.2,Doença Cardíaca e Renal Hipertensiva Com Insuficiência Cardíaca (congestiva) e Insuficiência Renal
I15.2,Hipertensão Secundária a Afecções Endócrinas
I21.2,Infarto Agudo Transmural do Miocárdio de Outras Localizações
I23.2,Comunicação Interventricular Como Complicação Atual Subseqüente ao Infarto Agudo do Miocárdio
I25.2,Infarto Antigo do Miocárdio
I27.2,Outra Hipertensão Pulmonar Secundária
I31.2,Hemopericárdio Não Classificado em Outra Parte
I34.2,"Estenose (da Valva) Mitral, Não-reumática"
I35.2,Estenose (da Valva) Aórtica Com Insuficiência
I36.2,"Estenose (da Valva) Tricúspide Com Insuficiência, Não-reumática"
I37.2,Estenose da Valva Pulmonar Com Insuficiência
I39.2,Transtornos da Valva Tricúspide em Doenças Classificadas em Outra Parte
I41.2,Miocardite em Outras Doenças Infecciosas e Parasitárias Classificadas em Outra Parte
I42.2,Outras Cardiomiopatias Hipertróficas
I43.2,Cardiomiopatia em Doenças Nutricionais
I44.2,Bloqueio Atrioventricular Total
I45.2,Bloqueio Bifascicular
I47.2,Taquicardia Ventricular
I49.2,Despolarização Juncional Prematura
I51.2,"Ruptura de Músculo Papilar, Não Classificada em Outra Parte"
I60.2,Hemorragia Subaracnóide Proveniente da Artéria Comunicante Anterior
I61.2,Hemorragia Intracerebral Hemisférica Não Especificada
I63.2,Infarto Cerebral Devido a Oclusão ou Estenose Não Especificadas de Artérias Pré-cerebrais
I65.2,Oclusão e Estenose da Artéria Carótida
I66.2,Oclusão e Estenose da Artéria Cerebral Posterior
I67.2,Aterosclerose Cerebral
I68.2,Arterite Cerebral em Outras Doenças Classificadas em Outra Parte
I69.2,Seqüelas de Outras Hemorragias Intracranianas Não Traumáticas
I70.2,Aterosclerose Das Artérias Das Extremidades
I71.2,"Aneurisma da Aorta Torácica, Sem Menção de Ruptura"
I72.2,Aneurisma da Artéria Renal
I74.2,Embolia e Trombose de Artérias Dos Membros Superiores
I77.2,Ruptura de Artéria
I79.2,Angiopatia Periférica em Doenças Classificadas em Outra Parte
I80.2,Flebite e Tromboflebite de Outros Vasos Profundos Dos Membros Inferiores
I82.2,Embolia e Trombose de Veia Cava
I83.2,Varizes Dos Membros Inferiores Com Úlcera e Inflamação
I84.2,Hemorróidas Internas Sem Complicações
I86.2,Varizes Pélvicas
I87.2,Insuficiência Venosa (crônica) (periférica)
I95.2,Hipotensão Devida a Drogas
I97.2,Síndrome do Linfedema Pós-mastectomia
I98.2,Varizes Esofagianas em Doenças Classificadas em Outra Parte
J01.2,Sinusite Etmoidal Aguda
J04.2,Laringotraqueíte Aguda
J12.2,Pneumonia Devida à Parainfluenza
J15.2,Pneumonia Devida a Staphylococcus
J17.2,Pneumonia em Micoses Classificadas em Outra Parte
J18.2,Pneumonia Hipostática Não Especificada
J20.2,Bronquite Aguda Devida a Estreptococos
J30.2,Outras Rinites Alérgicas Sazonais
J31.2,Faringite Crônica
J32.2,Sinusite Etmoidal Crônica
J34.2,Desvio do Septo Nasal
J35.2,Hipertrofia Das Adenóides
J38.2,Nódulos Das Cordas Vocais
J39.2,Outras Doenças da Faringe
J43.2,Enfisema Centrolobular
J63.2,Beriliose
J66.2,Canabinose
J67.2,Pulmão Dos Criadores de Pássaros
J68.2,"Inflamação Das Vias Aéreas Superiores Devida a Produtos Químicos, Gases, Fumaças e Vapores, Não Classificada em Outra Parte"
J70.2,"Transtornos Pulmonares Intersticiais Agudos, Induzidos Por Droga"
J85.2,Abscesso do Pulmão Sem Pneumonia
J94.2,Hemotórax
J95.2,Insuficiência Pulmonar Aguda Subsequente a Cirurgia Não Torácica
J98.2,Enfisema Intersticial
K00.2,Anomalias do Tamanho e da Forma Dos Dentes
K02.2,Cárie do Cemento
K03.2,Erosão Dentária
K04.2,Degeneração da Polpa
K05.2,Periodontite Aguda
K06.2,"Lesões da Gengiva e do Rebordo Alveolar Sem Dentes, Associadas a Traumatismos"
K07.2,Anomalias da Relação Entre as Arcadas Dentárias
K08.2,Atrofia do Rebordo Alveolar Sem Dentes
K09.2,Outros Cistos Das Mandíbulas
K10.2,Afecções Inflamatórias Dos Maxilares
K11.2,Sialadenite
K12.2,Celulite e Abscesso da Boca
K13.2,"Leucoplasia e Outras Afecções do Epitélio Oral, Inclusive da Língua"
K14.2,Glossite Rombóide Mediana
K22.2,Obstrução do Esôfago
K25.2,Úlcera Gástrica - Aguda Com Hemorragia e Perfuração
K26.2,Úlcera Duodenal - Aguda Com Hemorragia e Perfuração
K27.2,Úlcera Péptica de Localização Não Especificada - Aguda Com Hemorragia e Perfuração
K28.2,Úlcera Gastrojejunal - Aguda Com Hemorragia e Perfuração
K29.2,Gastrite Alcoólica
K31.2,Estenose e Estreitamento em Ampulheta do Estômago
K38.2,Divertículo do Apêndice
K40.2,"Hérnia Inguinal Bilateral, Sem Obstrução ou Gangrena"
K41.2,"Hérnia Femoral Bilateral, Sem Obstrução ou Gangrena"
K51.2,Proctite Ulcerativa (crônica)
K52.2,Gastroenterite e Colite Alérgicas ou Ligadas à Dieta
K55.2,Angiodisplasia do Cólon
K56.2,Volvo
K57.2,Doença Diverticular do Intestino Grosso Com Perfuração e Abscesso
K59.2,Cólon Neurogênico Não Classificado em Outra Parte
K60.2,"Fissura Anal, Não Especificada"
K61.2,Abscesso Anorretal
K62.2,Prolapso Anal
K63.2,Fístula do Intestino
K67.2,Peritonite Sifilítica
K70.2,Fibrose e Esclerose Alcoólicas do Fígado
K71.2,Doença Hepática Tóxica Com Hepatite Aguda
K73.2,"Hepatite Crônica Ativa, Não Classificada em Outra Parte"
K74.2,Fibrose Hepática Com Esclerose Hepática
K75.2,Hepatite Reativa Não-específica
K76.2,Necrose Hemorrágica Central do Fígado
K80.2,Calculose da Vesícula Biliar Sem Colecistite
K82.2,Perfuração da Vesícula Biliar
K83.2,Perfuração de Via Biliar
K85.2,Pancreatite Aguda Induzida Por Álcool
K86.2,Cisto do Pâncreas
K90.2,Síndrome da Alça Cega Não Classificada em Outra Parte
K91.2,Má-absorção Pós-cirúrgica Não Classificada em Outra Parte
K92.2,"Hemorragia Gastrointestinal, Sem Outra Especificação"
L02.2,"Abscesso Cutâneo, Furúnculo e Antraz do Tronco"
L03.2,Celulite da Face
L04.2,Linfadenite Aguda de Membro Superior
L10.2,Pênfigo Foliáceo
L12.2,Doença Bolhosa Crônica da Infância
L23.2,Dermatite Alérgica de Contato Devida a Cosméticos
L24.2,Dermatite de Contato Por Irritantes Devida a Solventes
L25.2,Dermatite de Contato Não Especificada Devida a Corantes
L27.2,Dermatite Devida à Ingestão de Alimentos
L28.2,Outras Formas de Prurigo
L29.2,Prurido Vulvar
L30.2,Autossensibilização Cutânea
L40.2,Acrodermatite Contínua
L41.2,Papulose Linfomatóide
L43.2,Reação Liquenóide a Droga
L44.2,Líquen Estriado
L50.2,Urticária Devida a Frio e a Calor
L51.2,Necrólise Epidérmica Tóxica (Síndrome de Lyell)
L53.2,Eritema Marginado
L55.2,Queimadura Solar de Terceiro Grau
L56.2,Dermatite Por Fotocontato (dermatite do Berloque)
L57.2,Cútis Romboidal da Nuca
L60.2,Onicogrifose
L63.2,Ofíase
L65.2,Alopécia Mucinosa
L66.2,Foliculite Descalvante
L68.2,Hipertricose Localizada
L70.2,Acne Varioliforme
L72.2,Esteatocistoma Múltiplo
L73.2,Hidradenite Supurativa
L74.2,Miliária Profunda
L75.2,Miliária Apócrina
L81.2,Sardas
L85.2,Ceratose Punctata (palmar e Plantar)
L87.2,Elastose Perfurante Serpiginosa
L90.2,Anetodermia de Jadassohn-Pellizzari
L92.2,Granuloma Facial (granuloma Eosinófilo da Pele)
L93.2,Outras Formas de Lúpus Eritematoso Localizado
L94.2,Calcinose Cutânea
L98.2,Dermatose Neutrofílica Febril (Sweet)
