I44.4,Bloqueio do Fascículo Anterior Esquerdo
I45.4,Bloqueio Intraventricular Não Específico
I49.4,Outras Formas de Despolarização Prematura e as Não Especificadas
I51.4,Miocardite Não Especificada
I60.4,Hemorragia Subaracnóide Proveniente da Artéria Basilar
I61.4,Hemorragia Intracerebral Cerebelar
I63.4,Infarto Cerebral Devido a Embolia de Artérias Cerebrais
I66.4,"Oclusão e Estenose de Artérias Cerebrais, Múltiplas e Bilaterais"
I67.4,Encefalopatia Hipertensiva
I69.4,Seqüelas de Acidente Vascular Cerebral Não Especificado Como Hemorrágico ou Isquêmico
I71.4,"Aneurisma da Aorta Abdominal, Sem Menção de Ruptura"
I72.4,Aneurisma de Artéria Dos Membros Inferiores
I74.4,Embolia e Trombose de Artérias Dos Membros Não Especificadas
I77.4,Síndrome de Compressão da Artéria Celíaca
I84.4,Hemorróidas Externas Com Outras Complicações
I86.4,Varizes Gástricas
J01.4,Pansinusite Aguda
J15.4,Pneumonia Devida a Outros Estreptococos
J20.4,Bronquite Aguda Devida a Vírus Parainfluenza
J30.4,Rinite Alérgica Não Especificada
J32.4,Pansinusite Crônica
J38.4,Edema da Laringe
J63.4,Siderose
J67.4,Pulmão Dos Trabalhadores do Malte
J68.4,"Afecções Respiratórias Crônicas Devidas a Produtos Químicos, Gases, Fumaças e Vapores"
J70.4,Transtornos Pulmonar Intersticial Não Especificado Induzido Por Droga
J95.4,Síndrome de Mendelson
J98.4,Outros Transtornos Pulmonares
K00.4,Distúrbios na Formação Dos Dentes
K02.4,Odontoclasia
K03.4,Hipercementose
K04.4,Periodontite Apical Aguda de Origem Pulpar
K05.4,Periodontose
K07.4,"Maloclusão, Não Especificada"
K11.4,Fístula de Glândula Salivar
K13.4,Lesões Granulomatosas e Granulomatóides da Mucosa Oral
K14.4,Atrofia Das Papilas Linguais
K22.4,Discinesia do Esôfago
K25.4,Úlcera Gástrica - Crônica ou Não Especificada Com Hemorragia
K26.4,Úlcera Duodenal - Crônica ou Não Especificada Com Hemorragia
K27.4,Úlcera Péptica de Localização Não Especificada - Crônica ou Não Especificada Com Hemorragia
K28.4,Úlcera Gastrojejunal - Crônica ou Não Especificada Com Hemorragia
K29.4,Gastrite Atrófica Crônica
K31.4,Divertículo Gástrico
K40.4,"Hérnia Inguinal Unilateral ou Não Especificada, Com Gangrena"
K41.4,"Hérnia Femoral Unilateral ou Não Especificada, Com Gangrena"
K51.4,Pseudopolipose do Cólon
K56.4,Outras Obstruções do Intestino
K57.4,Doença Diverticular Concomitante Dos Intestinos Delgado e Grosso Com Perfuração e Abscesso
K59.4,Espasmo Anal
K60.4,Fístula Retal
K61.4,Abscesso Intra-esfincteriano
K62.4,Estenose do Ânus e do Reto
K63.4,Enteroptose
K70.4,Insuficiência Hepática Alcoólica
K71.4,Doença Hepática Tóxica Com Hepatite Crônica Lobular
K74.4,Cirrose Biliar Secundária
K75.4,Hepatite Autoimune
K76.4,Peliose Hepática
K80.4,Calculose de Via Biliar Com Colecistite
K82.4,Colesterolose da Vesícula Biliar
K83.4,Espasmo do Esfíncter de Oddi
K90.4,Má-absorção Devida a Intolerância Não Classificada em Outra Parte
K91.4,Mau Funcionamento de Colostomia e Enterostomia
L02.4,"Abscesso Cutâneo, Furúnculo e Antraz Do(s) Membro(s)"
L10.4,Pênfigo Eritematoso
L23.4,Dermatite Alérgica de Contato Devida a Corantes
L24.4,Dermatite de Contato Por Irritantes Devida a Drogas em Contato Com a Pele
L25.4,Dermatite de Contato Não Especificada Devida a Alimentos em Contato Com a Pele
L30.4,Intertrigo Eritematoso
L40.4,Psoríase Gutata
L41.4,Parapsoríase de Grandes Placas
L44.4,Acrodermatite Papular Infantil (Síndrome de Gianotti-Crosti)
L50.4,Urticária Vibratória
L56.4,Erupção Polimorfa à Luz
L57.4,Cútis Laxa Senil
L60.4,Linhas de Beau
L66.4,Foliculite Uleritematosa Reticulada
L70.4,Acne Infantil
L74.4,Anidrose
L81.4,Outras Formas de Hiperpigmentação Pela Melanina
L90.4,Acrodermatite Crônica Atrófica
L94.4,Pápulas de Gottron
L98.4,"Úlcera Crônica da Pele, Não Classificada em Outra Parte"
M01.4,Artrite na Rubéola
M06.4,Poliartropatia Inflamatória
M07.4,Artropatia na Doença de Crohn (enterite Regional)
M08.4,Artrite Juvenil Pauciarticular
M10.4,Outra Gota Secundária
M12.4,Hidrartrose Intermitente
M14.4,Artropatia na Amiloidose
M15.4,(Osteo)artrose Erosiva
M16.4,Coxartrose Bilateral Pós-traumática
M17.4,Outras Gonartroses Secundárias Bilaterais
M18.4,Outras Cartroses Secundárias Bilaterais Das Primeiras Articulações Carpometacarpianas
M20.4,Dedo(s) do pé em Malho (adquirido)
M21.4,Pé Chato (pé Plano) (adquirido)
M22.4,Condromalácia da Rótula
M23.4,Corpo Flutuante no Joelho
M24.4,Deslocamento e Subluxação de Articulação Recidivantes
M25.4,Derrame Articular
M31.4,Síndrome do Arco Aórtico (Takayasu)
M35.4,Fasciíte (eosinofílica) Difusa
M36.4,Artropatia Associada a Reações de Hipersensibilidade Classificadas em Outra Parte
M40.4,Outras Lordoses
M41.4,Escoliose Neuromuscular
M43.4,Outras Subluxações Atlanto-axiais Recidivantes
M46.4,Discite Não Especificada
M48.4,Fratura de Fadiga de Vértebra
M49.4,Espondilopatia Neuropática
M51.4,Nódulos de Schmorl
M54.4,Lumbago Com Ciática
M61.4,Outra Calcificação de Músculo
M62.4,Contratura de Músculo
M65.4,Tenossinovite Estilóide Radial (de Quervain)
M66.4,Ruptura Espontânea de Outros Tendões
M67.4,Gânglios
M70.4,Bursite Pré-patelar
M71.4,Depósito de Cálcio em Bolsa Sinovial
M72.4,Fibromatose Pseudossarcomatosa
M75.4,Síndrome de Colisão do Ombro
M76.4,Bursite Tibial Colateral (Pellegrini-Stieda)
M77.4,Metatarsalgia
M79.4,Hipertrofia do Coxim Gorduroso (infrapatelar)
M80.4,Osteoporose Induzida Por Drogas Com Fratura Patológica
M81.4,Osteoporose Induzida Por Drogas
M83.4,Doença Óssea Pelo Alumínio
M84.4,Fratura Patológica Não Classificada em Outra Parte
M85.4,Cisto Ósseo Solitário
M86.4,Osteomielite Crônica Com Seio Drenante
M89.4,Outras Osteoartropatias Hipertróficas
M90.4,Osteonecrose Devida à Hemoglobinopatia
M92.4,Osteocondrose Juvenil da Rótula (patela)
M95.4,Deformidade Adquirida do Tórax e Das Costelas
M96.4,Lordose Pós-cirúrgica
M99.4,Estenose de Tecido Conjuntivo do Canal Medular
N00.4,Síndrome Nefrítica Aguda - Glomerulonefrite Proliferativa Endocapilar Difusa
N01.4,Síndrome Nefrítica Rapidamente Progressiva - Glomerulonefrite Proliferativa Endocapilar Difusa
N02.4,Hematúria Recidivante e Persistente - Glomerulonefrite Proliferativa Endocapilar Difusa
N03.4,Síndrome Nefrítica Crônica - Glomerulonefrite Proliferativa Endocapilar Difusa
N04.4,Síndrome Nefrótica - Glomerulonefrite Proliferativa Endocapilar Difusa
N05.4,Síndrome Nefrítica Não Especificada - Glomerulonefrite Proliferativa Endocapilar Difusa
N06.4,Proteinúria Isolada Com Lesão Morfológica Especificada - Glomerulonefrite Proliferativa Endocapilar Difusa
N07.4,Nefropatia Hereditária Não Classificada em Outra Parte - Glomerulonefrite Proliferativa Endocapilar Difusa
N08.4,"Transtornos Glomerulares em Doenças Endócrinas, Nutricionais e Metabólicas"
N13.4,Hidroureter
N14.4,Nefropatia Tóxica Não Classificada em Outra Parte
N16.4,Transtornos Renais Túbulo-intersticiais em Doenças do Tecido Conjuntivo
N30.4,Cistite Por Radiação
N32.4,"Ruptura da Bexiga, Não-traumática"
N39.4,Outras Incontinências Urinárias Especificadas
N43.4,Espermatocele
N48.4,Impotência de Origem Orgânica
N60.4,Ectasia de Dutos Mamários
N64.4,Mastodinia
N73.4,Pelviperitonite Crônica Feminina
N74.4,Infecção Pélvica Feminina Por Clamídia
N76.4,Abscesso Vulvar
N80.4,Endometriose do Septo Retovaginal e da Vagina
N81.4,Prolapso Uterovaginal Não Especificado
N82.4,Outras Fístulas Genito-intestinais Femininas
N83.4,Prolapso e Hérnia do Ovário e da Trompa de Falópio
N85.4,Posição Anormal do Útero
N88.4,Alongamento Hipertrófico do Colo do Útero
N89.4,Leucoplasia da Vagina
N90.4,Leucoplasia de Vulva
N91.4,Oligomenorréia Secundária
N92.4,Sangramento Abundante na Pré-menopausa
N94.4,Dismenorréia Primária
N97.4,Infertilidade Feminina Associada à Fatores do Parceiro
N99.4,Aderências do Peritônio Pélvico Pós-procedimentos
O03.4,"Aborto Espontâneo - Incompleto, Sem Complicações"
O04.4,"Aborto Por Razões Médicas e Legais - Incompleto, Sem Complicações"
O05.4,"Outros Tipos de Aborto - Incompleto, Sem Complicações"
O06.4,"Aborto Não Especificado - Incompleto, Sem Complicações"
O07.4,"Falha de Aborto Provocado Por Razões Médicas, Sem Complicações"
O08.4,Insuficiência Renal Conseqüente a Aborto e a Gravidez Ectópica e Molar
O10.4,"Hipertensão Secundária Pré-existente Complicando a Gravidez, o Parto e o Puerpério"
O22.4,Hemorróidas na Gravidez
O23.4,Infecção Não Especificada do Trato Urinário na Gravidez
O24.4,Diabetes Mellitus Que Surge Durante a Gravidez
O26.4,Herpes Gestacional
O28.4,"""Achados Radiológicos Anormais do Rastreamento (""""screening"""") Antenatal da Mãe"""
O29.4,Cefaléia Causada Por Anestesia Raquidiana ou Peridural Administradas Durante a Gravidez
O32.4,Assistência Prestada à Mãe Por Polo Cefálico Alto em Gestação a Termo
O33.4,"Assistência Prestada à Mãe Por Uma Desproporção de Origem Mista, Materna e Fetal"
O34.4,Assistência Prestada à Mãe Por Outras Anormalidades do Colo do Útero
O35.4,Assistência Prestada à Mãe Por Lesão (suspeitada) Causada ao Feto Por Alcoolismo Materno
O36.4,Assistência Prestada à Mãe Por Morte Intra-uterina
O62.4,"Contrações Uterinas Hipertônicas, Incoordenadas ou Prolongadas"
O64.4,Obstrução do Trabalho de Parto Devida à Apresentação de Ombro
O65.4,"Obstrução do Trabalho de Parto Devida a Desproporção Feto-pélvica, Não Especificada"
O66.4,"Falha de Tentativa de Trabalho de Parto, Não Especificada"
O69.4,Trabalho de Parto e Parto Complicados Por Vasa Praevia
O71.4,"Laceração Vaginal Alta Isolada, de Origem Obstétrica"
O74.4,Reação Tóxica a Anestesia Local Durante Trabalho de Parto e o Parto
O75.4,Outras Complicações de Procedimentos ou de Cirurgia Obstétrica
O81.4,Parto Por Vácuo-extrator
O83.4,Cirurgia Destrutiva Para Facilitar o Parto
O86.4,Febre de Origem Desconhecida Subseqüente ao Parto
O89.4,"Cefaléia Provocada Por Uma Anestesia Raquidiana ou Peridural, Durante o Puerpério"
O90.4,Insuficiência Renal Aguda do Pós-parto
O92.4,Hipogalactia
O98.4,"Hepatite Viral Complicando a Gravidez, o Parto e o Puerpério"
O99.4,"Doenças do Aparelho Circulatório Complicando a Gravidez, o Parto e o Puerpério"
P00.4,Feto e Recém-nascido Afetados Por Transtornos Nutricionais Maternos
P01.4,Feto e Recém-nascido Afetados Por Gravidez Ectópica
P02.4,Feto e Recém-nascido Afetados Por Prolapso de Cordão Umbilical
P03.4,Feto e Recém-nascido Afetados Por Parto Por Cesariana
P04.4,Feto e Recém-nascido Afetados Pelo Uso de Drogas Que Causam Dependência Pela Mãe
P10.4,Ruptura Tentorial Devida a Traumatismo de Parto
P11.4,Traumatismo de Parto de Outros Nervos Cranianos
P12.4,Lesão Por Monitorização do Couro Cabeludo do Recém-nascido
P13.4,Fratura da Clavícula Devida a Traumatismo de Parto
P15.4,Lesão da Face ao Nascer
P23.4,Pneumonia Congênita Devida a Escherichia Coli
P28.4,Outras Apnéias do Recém-nascido
P29.4,Isquemia Miocárdica Transitória do Recém-nascido
P36.4,Septicemia do Recém-nascido Devida a Escherichia Coli
P37.4,Outras Malárias Congênitas
P39.4,Infecção Neonatal da Pele
P50.4,Hemorragia Para a Circulação Materna
P52.4,Hemorragia Intracerebral (não-traumática) do Feto e do Recém-nascido
P54.4,Hemorragia Supra-renal Neonatal
P58.4,Icterícia Neonatal Devida a Drogas ou Toxinas Transmitidas Pela Mãe ou Administradas ao Recém-nascido
P61.4,Outras Anemias Congênitas Não Classificada em Outra Parte
P70.4,Outras Hipoglicemias Neonatais
P71.4,Hipoparatiroidismo Neonatal Transitório
P74.4,Outros Distúrbios Eletrolíticos Transitórios do Recém-nascido
P83.4,Intumescimento Mamário do Recém-nascido
P91.4,Depressão Cerebral Neonatal
P92.4,Hiperalimentação do Recém-nascido
P96.4,"Interrupção de Gravidez, Afetando o Feto e Recém-nascido"
Q04.4,Displasia do Septo e Das Vias Ópticas
Q05.4,"Espinha Bífida Não Especificada, Com Hidrocefalia"
Q06.4,Hidromielia
Q10.4,Ausência ou Agenesia do Aparelho Lacrimal
Q12.4,Esferofaquia
Q13.4,Outras Malformações Congênitas da Córnea
Q16.4,Outras Malformações Congênitas do Ouvido Médio
Q17.4,Anomalia de Posição da Orelha
Q18.4,Macrostomia
Q20.4,Ventrículo Com Dupla Via de Entrada
Q21.4,Comunicação Aortopulmonar
Q22.4,Estenose Congênita da Valva Tricúspide
Q23.4,Síndrome do Coração Esquerdo Hipoplásico
Q24.4,Estenose Subaórtica Congênita
Q25.4,Outras Malformações Congênitas da Aorta
Q26.4,Comunicação Venosa Pulmonar Anormal Não Especificado
Q27.4,Ectasia Venosa (flebectasia) Congênita
Q32.4,Outras Malformações Congênitas Dos Brônquios
Q33.4,Bronquectasia Congênita
Q37.4,Fenda Dos Palatos Duro e Mole Com Fenda Labial Bilateral
Q38.4,Malformações Congênitas Das Glândulas e Dutos Salivares
Q39.4,Pterígio do Esôfago
Q43.4,Duplicação do Intestino
Q44.4,Cisto do Colédoco
Q50.4,Cisto Embrionário da Trompa de Falópio
Q51.4,Útero Unicórneo
Q52.4,Outras Malformações Congênitas da Vagina
Q54.4,Corda Venérea Congênita
Q55.4,"Outras Malformações Congênitas do Canal Deferente, do Epidídimo, Das Vesículas Seminais e da Próstata"
Q56.4,"Sexo Indeterminado, Não Especificado"
Q60.4,Hipoplasia Renal Bilateral
Q61.4,Displasia Renal
Q62.4,Agenesia do Ureter
Q64.4,Malformação do Úraco
Q65.4,Subluxação Congênita Bilateral do Quadril
Q66.4,Pé Torto Calcaneovalgo
Q67.4,"Outras Deformidades Congênitas do Crânio, da Face e da Mandíbula"
Q68.4,Encurvamento Congênito da Tíbia e da Perônio (fíbula)
Q70.4,Polissindactilia
Q71.4,Defeito de Redução Longitudinal do Rádio
Q72.4,Defeito Por Redução Longitudinal da Tíbia
Q75.4,Disostose Mandíbulo-facial
Q76.4,Outras Malformações Congênitas da Coluna Vertebral Não-associadas Com Escoliose
Q77.4,Acondroplasia
Q78.4,Encondromatose
Q79.4,"""Síndrome do Abdome em Ameixa Seca (""""prune Belly Syndrome"""")"""
Q80.4,Feto Arlequim
Q82.4,Displasia Ectodérmica (anidrótica)
Q84.4,Leuconíquia Congênita
Q87.4,Síndrome de Marfan
Q89.4,Reunião de Gêmeos
Q91.4,"Trissomia 13, Não-disjunção Meiótica"
Q92.4,Duplicações Vistas Somente na Prometáfase
Q93.4,Deleção do Braço Curto do Cromossomo 5
Q95.4,Sujeito Com Marcador de Heterocromatina
Q96.4,"Mosaicismo Cromossômico, 45, X/outra(s) Linhagens Celular(es) Com Cromossomo Sexual Anormal"
Q98.4,Síndrome de Klinefelter Não Especificada
R06.4,Hiperventilação
R07.4,"Dor Torácica, Não Especificada"
R10.4,Outras Dores Abdominais e as Não Especificadas
R19.4,Alteração do Hábito Intestinal
R22.4,"Tumefação, Massa ou Tumoração Localizadas no Membro Inferior"
R23.4,Alterações na Textura da Pele
R29.4,Quadril Estalante
R45.4,Irritabilidade e Mau Humor
R46.4,Lentidão e Baixa Reatividade
R63.4,Perda de Peso Anormal
R78.4,"Presença de Outras Drogas Com Potencial de Causar Dependência, no Sangue"
R82.4,Acetonúria
R83.4,Achados Anormais no Líquido Cefalorraquidiano - Achados Imunológicos Anormais
R84.4,Achados Anormais de Material Proveniente Dos Órgãos Respiratórios e do Tórax - Achados Imunológicos Anormais
R85.4,Achados Anormais de Material Proveniente Dos Órgãos Digestivos e da Cavidade Abdominal - Achados Imunológicos Anormais
R86.4,Achados Anormais de Material Proveniente Dos Órgãos Genitais Masculinos - Achados Imunológicos Anormais
R87.4,Achados Anormais de Material Proveniente Dos Órgãos Genitais Femininos - Achados Imunológicos Anormais
R89.4,"Achados Anormais de Material Proveniente de Outros Órgãos, Aparelhos, Sistemas e Tecidos - Achados Imunológicos Anormais"
R93.4,Achados Anormais de Exames Para Diagnóstico Por Imagem Dos Órgãos Urinários
R94.4,Resultados Anormais de Estudos de Função Renal
S00.4,Traumatismo Superficial do Ouvido
S01.4,Ferimento da Bochecha e Região Têmporo-mandibular
S02.4,Fratura Dos Ossos Malares e Maxilares
S03.4,Entorse e Distensão do Maxilar
S04.4,Traumatismo do Nervo Abducente
S05.4,Ferimento Penetrante da Órbita Com ou Sem Corpo Estranho
S06.4,Hemorragia Epidural
S13.4,Distensão e Entorse da Coluna Cervical
S14.4,Traumatismo Dos Nervos Periféricos do Pescoço
S20.4,Outros Traumatismos Superficiais da Parede Posterior do Tórax
S22.4,Fraturas Múltiplas de Costelas
S23.4,Entorse e Distensão Das Costelas e do Esterno
S24.4,Traumatismo de Nervos Simpáticos do Tórax
S25.4,Traumatismo de Vasos Sangüíneos Pulmonares
S27.4,Traumatismo Dos Brônquios
S31.4,Ferimento da Vagina e da Vulva
S32.4,Fratura do Acetábulo
S33.4,Ruptura Traumática da Sínfise Púbica
S34.4,Traumatismo do Plexo Lombossacro
S35.4,Traumatismo de Vaso Sangüíneo Renal
S36.4,Traumatismo do Intestino Delgado
S37.4,Traumatismo do Ovário
S42.4,Fratura da Extremidade Inferior do Úmero
S43.4,Entorse e Distensão de Articulação do Ombro
S44.4,Traumatismo do Nervo Musculocutâneo
S52.4,Fratura Das Diáfises do Rádio e do Cúbito (ulna)
S53.4,Entorse e Distensão do Cotovelo
S56.4,Traumatismo do Músculo Extensor e Tendão de Outro(s) Dedo(s) ao Nível do Antebraço
S62.4,Fraturas Múltiplas de Ossos Metacarpianos
S63.4,Ruptura Traumática do Ligamento do Dedo Nas Articulações Metacarpofalangianas e Interfalangianas
S64.4,Traumatismo do Nervo Digital de Outro Dedo
S65.4,Traumatismo de Vaso(s) Sangüíneo(s) do Polegar
S66.4,Traumatismo do Músculo Intrínseco e Tendão do Polegar ao Nível do Punho e da Mão
S68.4,Amputação Traumática da Mão ao Nível do Punho
S72.4,Fratura da Extremidade Distal do Fêmur
S76.4,Traumatismo de Outros Músculos e Tendões e os Não Especificados ao Nível da Coxa
S82.4,Fratura do Perônio (fíbula)
S83.4,Entorse e Distensão Envolvendo Ligamento Colateral (peronial) (tibial) do Joelho
S85.4,Traumatismo da Veia Safena Menor ao Nível da Perna
S92.4,Fratura do Hálux
S93.4,Entorse e Distensão do Tornozelo
S98.4,Amputação Traumática do pé ao Nível Não Especificado
T02.4,Fraturas Envolvendo Regiões Múltiplas de Ambos os Membros Superiores
T03.4,"Luxações, Entorses e Distensões Envolvendo Regiões Múltiplas Dos Membros Superiores Com Inferiores"
T04.4,Traumatismos Por Esmagamento Envolvendo Regiões Múltiplas Do(s) Membro(s) Superior(es) Com Inferior(es)
T05.4,"Amputação Traumática de um pé e Outra Perna (qualquer Nível, Exceto Pé)"
T06.4,Traumatismos de Músculos e de Tendões Envolvendo Regiões Múltiplas do Corpo
T09.4,"Traumatismo de Nervos, de Raízes de Nervos Espinhais e de Plexos Não Especificados do Tronco"
T11.4,"Traumatismo de Vaso Sangüíneo Não Especificado, do Membro Superior, Nível Não Especificado"
T13.4,"Traumatismo de Vaso Sangüíneo Não Especificado de Membro Inferior, Nível Não Especificado"
T14.4,Traumatismo de Nervo(s) de Região Não Especificada do Corpo
T17.4,Corpo Estranho na Traquéia
T18.4,Corpo Estranho no Cólon
T20.4,"Corrosão da Cabeça e do Pescoço, Grau Não Especificado"
T21.4,"Corrosão do Tronco, Grau Não Especificado"
T22.4,"Corrosão do Ombro e do Membro Superior, Exceto Punho e Mão, Grau Não Especificado"
T23.4,"Corrosão do Punho e da Mão, Grau Não Especificado"
T24.4,"Corrosão do Quadril e do Membro Inferior, Exceto Tornozelo e do Pé, Grau Não Especificado"
T25.4,"Corrosão do Tornozelo e do Pé, Grau Não Especificado"
T26.4,"Queimadura do Olho e Anexos, Parte Não Especificada"
T27.4,Corrosão da Laringe e Traquéia
T28.4,Queimadura de Outros Órgãos Internos e Dos Não Especificados
T29.4,"Corrosões Múltiplas, Grau Não Especificado"
T30.4,"Corrosão, Parte do Corpo Não Especificada, Grau Não Especificado"
T31.4,Queimaduras Envolvendo de 40 - 49% da Superfície Corporal
T32.4,Corrosões Envolvendo 40 - 49% da Superfície Corporal
T33.4,Geladura Superficial do Braço
T34.4,"Geladura, Com Necrose de Tecidos, do Braço"
T35.4,"Geladura, de Grau Não Especificado, do Membro Superior"
T36.4,Intoxicação Por Tetraciclinas
T37.4,Intoxicação Por Anti-helmínticos
T38.4,Intoxicação Por Anticoncepcionais Orais
T39.4,Intoxicação Por Anti-reumáticos Não Classificados em Outra Parte
T40.4,Intoxicação Por Outros Narcóticos Sintéticos
T41.4,Intoxicação Por Anestésico Não Especificado
T42.4,Intoxicação Por Benzodiazepinas
T43.4,Intoxicação Por Neurolépticos do Tipo Butirofenona e Tioxanteno
T44.4,Intoxicação Por Agonistas Principalmente Alfa-adrenorreceptores Não Classificados em Outra Parte
T45.4,Intoxicação Por Ferro e Seus Compostos
T46.4,Intoxicação Por Inibidores da Enzima de Conversão da Angiotensina
T47.4,Intoxicação Por Outros Laxativos
T48.4,Intoxicação Por Expectorantes
T49.4,"Intoxicação Por Ceratolíticos, Ceratoplásticos e Outras Drogas e Preparados Para o Tratamento Dos Cabelos"
T50.4,Intoxicação Por Drogas Que Agem Sobre o Metabolismo do Ácido Úrico
T52.4,Efeito Tóxico de Cetonas
T53.4,Efeito Tóxico do Diclorometano
T56.4,Efeito Tóxico do Cobre e Seus Compostos
T59.4,Efeito Tóxico do Cloro Gasoso
T60.4,Efeito Tóxico de Rodenticidas
T63.4,Efeito Tóxico do Veneno de Outros Artrópodes
T65.4,Efeito Tóxico do Dissulfeto de Carbono
T67.4,Exaustão Devida ao Calor e à Perda de Sal
T70.4,Efeito Dos Fluidos em Alta Pressão
T75.4,Efeitos da Corrente Elétrica
T78.4,Alergia Não Especificada
T79.4,Choque Traumático
T80.4,Reação de Incompatibilidade Rh
T81.4,Infecção Subseqüente a Procedimento Não Classificada em Outra Parte
T82.4,Complicação Mecânica de Cateter Vascular de Diálise
T83.4,"Complicação Mecânica de Outros Dispositivos Protéticos, Implantes e Enxertos do Trato Genital"
T84.4,"Complicação Mecânica de Outros Dispositivos, Implantes e Enxertos Ortopédicos Internos"
T85.4,Complicação Mecânica de Prótese e Implante Mamários
T86.4,Falência ou Rejeição de Transplante de Fígado
T87.4,Infecção de Coto da Amputação
T88.4,Entubação Falha ou Difícil
T90.4,Seqüelas de Traumatismo do Olho e da Órbita
T91.4,Seqüelas de Traumatismo de Órgãos Intratorácicos
T92.4,Seqüelas de Traumatismo de Nervo de Membro Superior
T93.4,Seqüelas de Traumatismo de Nervo do Membro Inferior
T95.4,Seqüelas de Queimadura e Corrosão Classificável só de Acordo Com a Extensão da Área Corporal Envolvida
V10.4,Ciclista Traumatizado em Colisão Com um Pedestre ou um Animal - Condutor Traumatizado em um Acidente de Trânsito
V11.4,Ciclista Traumatizado em Colisão Com Outro Veículo a Pedal - Condutor Traumatizado em um Acidente de Trânsito
V12.4,Ciclista Traumatizado em Colisão Com um Veículo a Motor de Duas ou Três Rodas - Condutor Traumatizado em um Acidente de Trânsito
V13.4,"""Ciclista Traumatizado em Colisão Com um Automóvel, """"pick Up"""" ou Caminhonete - Condutor Traumatizado em um Acidente de Trânsito"""
V14.4,Ciclista Traumatizado em Colisão Com um Veículo de Transporte Pesado ou um Ônibus - Condutor Traumatizado em um Acidente de Trânsito
V15.4,Ciclista Traumatizado em Colisão Com um Trem ou um Veículo Ferroviário - Condutor Traumatizado em um Acidente de Trânsito
V16.4,Ciclista Traumatizado em Colisão Com Outro Veículo Não-motorizado - Condutor Traumatizado em um Acidente de Trânsito
V17.4,Ciclista Traumatizado em Colisão Com um Objeto Fixo ou Parado - Condutor Traumatizado em um Acidente de Trânsito
V18.4,Ciclista Traumatizado em um Acidente de Transporte Sem Colisão - Condutor Traumatizado em um Acidente de Trânsito
V19.4,"Condutor Traumatizado em Colisão Com Outros Veículos e Com Veículos Não Especificados, a Motor, em um Acidente de Trânsito"
V20.4,Motociclista Traumatizado em Colisão Com um Pedestre ou um Animal - Condutor Traumatizado em um Acidente de Trânsito
V21.4,Motociclista Traumatizado em Colisão Com um Veículo a Pedal - Condutor Traumatizado em um Acidente de Trânsito
V22.4,Motociclista Traumatizado em Colisão Com um Veículo a Motor de Duas ou Três Rodas - Condutor Traumatizado em um Acidente de Trânsito
V23.4,"""Motociclista Traumatizado em Colisão Com um Automóvel (carro), """"pick Up"""" ou Caminhonete - Condutor Traumatizado em um Acidente de Trânsito"""
V24.4,Motociclista Traumatizado em Colisão Com um Veículo de Transporte Pesado ou um Ônibus - Condutor Traumatizado em um Acidente de Trânsito
V25.4,Motociclista Traumatizado em Colisão Com um Trem ou um Veículo Ferroviário - Condutor Traumatizado em um Acidente de Trânsito
V26.4,Motociclista Traumatizado em Colisão Com Outro Veículo Não-motorizado - Condutor Traumatizado em um Acidente de Trânsito
V27.4,Motociclista Traumatizado em Colisão Com um Objeto Fixo ou Parado - Condutor Traumatizado em um Acidente de Trânsito
V28.4,Motociclista Traumatizado em um Acidente de Transporte Sem Colisão - Condutor Traumatizado em um Acidente de Trânsito
V29.4,"Condutor Traumatizado em Colisão Com Outros Veículos e Com Veículos Não Especificados, a Motor, em um Acidente de Trânsito"
V30.4,Ocupante de um Triciclo Motorizado Traumatizado em Colisão Com um Pedestre ou um Animal - Pessoa Traumatizada ao Subir ou Descer do Veículo
V31.4,Ocupante de um Triciclo Motorizado Traumatizado em Colisão Com um Veículo a Pedal - Pessoa Traumatizada ao Subir ou Descer do Veículo
V32.4,Ocupante de um Triciclo Motorizado Traumatizado em Colisão Com Outro Veículo a Motor de Duas ou Três Rodas - Pessoa Traumatizada ao Subir ou Descer do Veículo
V33.4,"""Ocupante de um Triciclo Motorizado Traumatizado em Colisão Com um Automóvel, """"pick Up"""" ou Caminhonete - Pessoa Traumatizada ao Subir ou Descer do Veículo"""
V34.4,Ocupante de um Triciclo Motorizado Traumatizado em Colisão Com um Veículo de Transporte Pesado ou um Ônibus - Pessoa Traumatizada ao Subir ou Descer do Veículo
V35.4,Ocupante de um Triciclo Motorizado Traumatizado em Colisão Com um Trem (comboio) ou um Veículo Ferroviário - Pessoa Traumatizada ao Subir ou Descer do Veículo
V36.4,Ocupante de um Triciclo Motorizado Traumatizado em Colisão Com Outro Veículo Não-motorizado - Pessoa Traumatizada ao Subir ou Descer do Veículo
