Y17.7,"Envenenamento (intoxicação) Por e Exposição a Outros Gases e Vapores, Intenção Não Determinada - Fazenda"
Y18.7,"Envenenamento (intoxicação) Por e Exposição a Pesticidas, Intenção Não Determinada - Fazenda"
Y19.7,"Envenenamento (intoxicação) Por e Exposição a Outros Produtos Químicos e Substâncias Nocivas e Aos Não Especificados, Intenção Não Determinada - Fazenda"
Y20.7,"Enforcamento, Estrangulamento e Sufocação, Intenção Não Determinada - Fazenda"
Y21.7,"Afogamento e Submersão, Intenção Não Determinada - Fazenda"
Y22.7,"Disparo de Pistola, Intenção Não Determinada - Fazenda"
Y23.7,"Disparo de Fuzil, Carabina e Arma de Fogo de Maior Calibre, Intenção Não Determinada - Fazenda"
Y24.7,"Disparo de Outra Arma de Fogo e de Arma de Fogo Não Especificada, Intenção Não Determinada - Fazenda"
Y25.7,"Contato Com Material Explosivo, Intenção Não Determinada - Fazenda"
Y26.7,"Exposição a Fumaça, Fogo e Chamas, Intenção Não Determinada - Fazenda"
Y27.7,"Exposição a Vapor de Água, Gases ou Objetos Quentes, Intenção Não Determinada - Fazenda"
Y28.7,"Contato Com Objeto Cortante ou Penetrante, Intenção Não Determinada - Fazenda"
Y29.7,"Contato Com Objeto Contundente, Intenção Não Determinada - Fazenda"
Y30.7,"Queda, Salto ou Empurrado de um Lugar Elevado, Intenção Não Determinada - Fazenda"
Y31.7,"Queda, Permanência ou Corrida Diante de um Objeto em Movimento, Intenção Não Determinada - Fazenda"
Y32.7,"Impacto de um Veículo a Motor, Intenção Não Determinada - Fazenda"
Y33.7,"Outros Fatos ou Eventos Especificados, Intenção Não Determinada - Fazenda"
Y34.7,Fatos ou Eventos Não Especificados e Intenção Não Determinada - Fazenda
Y35.7,"Intervenção Legal, Meio Não Especificado"
Y36.7,Operações de Guerra Envolvendo Armas Químicas e Outros Meios de Combate Não-convencionais
Y40.7,Efeitos Adversos de Antibióticos Antifúngicos Administrados Por Via Sistêmica
Y42.7,Efeitos Adversos de Andrógenos e Anabolizantes Congêneres
Y44.7,Efeitos Adversos de Substitutos do Plasma
Y46.7,Efeitos Adversos de Drogas Antiparkinsonianas
Y49.7,Efeitos Adversos de Psicoestimulantes Que Podem Provocar Dependência
Y51.7,"Efeitos Adversos de Antagonistas Beta-adrenorreceptores, Não Classificados em Outra Parte"
Y52.7,Efeitos Adversos de Vasodilatadores Periféricos
Y53.7,Efeitos Adversos de Eméticos
Y54.7,Efeitos Adversos de Medicamentos Que Atuam Sobre o Metabolismo de Cálcio
Y56.7,Efeitos Adversos de Drogas de Uso Dentário Aplicadas Topicamente
Y57.7,"Efeitos Adversos de Vitaminas, Não Classificadas em Outra Parte"
Y60.7,"Corte, Punção, Perfuração ou Hemorragia Acidentais Durante a Administração de Enema"
Y61.7,Objeto Estranho Deixado Acidentalmente no Corpo Durante a Extração de um Cateter ou de Compressas
Y84.7,"Reação Anormal em Paciente ou Complicação Tardia, Causadas Por Amostra de Sangue, Sem Menção de Acidente Durante o Procedimento"
Y90.7,Alcoolemia de 200-239 Mg/100ml
Z01.7,Exame de Laboratório
Z02.7,Obtenção de Atestado Médico
Z08.7,Exame de Seguimento Após Tratamento Misto Por Neoplasia Maligna
Z09.7,Exame de Seguimento Após Tratamento Combinado Por Outras Afecções
Z13.7,"Exame Especial de Rastreamento de Malformações Congênitas, Deformidades e Anomalias Cromossômicas"
Z20.7,"Contato Com e Exposição à Pediculose, Acaríase e Outras Infestações"
Z23.7,Necessidade de Imunização Somente Contra a Coqueluche
Z35.7,Supervisão de Gravidez de Alto Risco Devido a Problemas Sociais
Z37.7,"Outros Nascimentos Múltiplos, Todos Natimortos (feto-mortos)"
Z38.7,"Outros Nascimentos Múltiplos, Fora de Hospital"
Z43.7,Cuidados à Vagina Artificial
Z46.7,Colocação e Ajustamento de Aparelho Ortopédico
Z50.7,Terapia Ocupacional e Reabilitação Vocacional Não Classificada em Outra Parte
Z52.7,Doador de Coração
Z54.7,Convalescença Após Tratamento Combinado
Z56.7,Outros Problemas e os Não Especificados Relacionados Com o Emprego
Z57.7,Exposição Ocupacional à Vibração
Z58.7,Exposição à Fumaça de Tabaco
Z59.7,Seguro Social e Medidas de Bem-estar Social Insuficientes
Z61.7,Experiência Pessoal Amedrontadora na Infância
Z63.7,Outros Acontecimentos Difíceis Com Incidência na Família ou no Lar
Z71.7,Aconselhamento a Propósito do Vírus da Imunodeficiência Humana (HIV)
Z80.7,"História Familiar de Outras Neoplasias Malignas Dos Tecidos Linfático, Hematopoético e Correlacionados"
Z82.7,História Familiar de Malformações e Deformações Congênitas e Anomalias Cromossômicas
Z83.7,História Familiar Das Doenças do Aparelho Digestivo
Z85.7,"História Pessoal de Outras Neoplasias Malignas do Tecido Linfático, Hematopoético e Tecidos Correlatos"
Z86.7,História Pessoal de Doenças do Aparelho Circulatório
Z87.7,História Pessoal de Malformações e Deformidades Congênitas e Anomalias Cromossômicas
Z88.7,História Pessoal de Alergia a Soro e à Vacina
Z89.7,"Ausência Adquirida de Ambos Membros Inferiores (qualquer Nível, Exceto Somente Artelhos)"
Z90.7,Ausência Adquirida de Órgão(s) Genital(is)
Z94.7,Córnea Transplantada
Z96.7,Presença de Outros Implantes de Osso e Tendão
A02.8,Outras Infecções Especificadas Por Salmonela
A03.8,Outras Shigueloses
A04.8,Outras Infecções Bacterianas Intestinais Especificadas
A05.8,Outras Intoxicações Alimentares Bacterianas Especificadas
A06.8,Infecção Amebiana de Outras Localizações
A07.8,Outras Doenças Intestinais Especificadas Por Protozoários
A15.8,"Outras Formas de Tuberculose Das Vias Respiratórias, Com Confirmação Bacteriológica e Histológica"
A16.8,"Outras Formas de Tuberculose Das Vias Respiratórias, Sem Menção de Confirmação Bacteriológica ou Histológica"
A17.8,Outras Tuberculoses do Sistema Nervoso
A18.8,Tuberculose de Outros Órgãos Especificados
A19.8,Outras Tuberculoses Miliares
A20.8,Outras Formas de Peste
A21.8,Outras Formas de Tularemia
A22.8,Outras Formas de Carbúnculo
A23.8,Outras Bruceloses
A26.8,Outras Formas de Erisipelóide
A27.8,Outras Formas de Leptospirose
A28.8,Outras Doenças Bacterianas Zoonóticas Especificadas Não Classificadas em Outra Parte
A30.8,Outras Formas de Hanseníase (lepra)
A31.8,Outras Infecções Micobacterianas
A32.8,Outras Formas de Listeriose
A36.8,Outras Formas de Difteria
A37.8,Coqueluche Por Outras Espécies da Bordetella
A39.8,Outras Infecções Por Meningococos
A40.8,Outras Septicemias Estreptocócicas
A41.8,Outras Septicemias Especificadas
A42.8,Outras Formas de Actinomicose
A43.8,Outras Formas de Nocardiose
A44.8,Outras Formas de Bartonelose
A48.8,Outras Doenças Bacterianas Especificadas
A49.8,Outras Infecções Bacterianas de Localização Não Especificada
A52.8,Sífilis Tardia Latente
A54.8,Outras Infecções Gonocócicas
A56.8,"Infecção Por Clamídias Transmitida Por Via Sexual, de Outras Localizações"
A59.8,Outras Localizações de Tricomoníase
A63.8,Outras Doenças Especificadas de Transmissão Predominantemente Sexual
A66.8,Bouba Latente
A69.8,Outras Infecções Especificadas Por Espiroquetas
A74.8,Outras Doenças Causadas Por Clamídias
A77.8,Outras Febres Maculosas
A79.8,Outros Tipos de Rickettsioses Especificadas
A81.8,Outras Infecções Por Vírus Atípicos do Sistema Nervoso Central
A83.8,Outras Encefalites Por Vírus Transmitidas Por Mosquitos
A84.8,Outras Encefalites Por Vírus Transmitidas Por Carrapatos
A85.8,Outras Encefalites Virais Especificadas
A87.8,Outras Meningites Virais
A88.8,Outras Infecções Virais Especificadas do Sistema Nervoso Central
A92.8,Outras Febres Virais Especificadas Transmitidas Por Mosquitos
A93.8,Outras Febres Virais Especificadas Transmitidas Por Artrópodes
A96.8,Outras Febres Hemorrágicas Por Arenavírus
A98.8,Outras Febres Hemorrágicas Especificadas Por Vírus
B00.8,Outras Formas de Infecção Devida ao Vírus do Herpes
B01.8,Varicela Com Outras Complicações
B02.8,Herpes Zoster Com Outras Complicações
B05.8,Sarampo Com Outras Complicações
B06.8,Rubéola Com Outras Complicações
B08.8,Outras Infecções Virais Especificadas Caracterizadas Por Lesões de Pele e Das Membranas Mucosas
B17.8,Outras Hepatites Virais Agudas Especificadas
B18.8,Outras Hepatites Crônicas Virais
B20.8,Doença Pelo HIV Resultando em Outras Doenças Infecciosas e Parasitárias
B21.8,Doença Pelo HIV Resultando em Outras Neoplasias Malignas
B23.8,Doença Pelo HIV Resultando em Outra Afecções Especificadas
B25.8,Outras Doenças Por Citomegalovírus
B26.8,Caxumba (parotidite Epidêmica) Com Outras Complicações
B27.8,Outras Mononucleoses Infecciosas
B30.8,Outras Conjuntivites Virais
B33.8,Outras Doenças Especificadas Por Vírus
B34.8,Outras Infecções Por Vírus de Localização Não Especificada
B35.8,Outras Dermatofitoses
B36.8,Outras Micoses Superficiais Especificadas
B37.8,Candidíase de Outras Localizações
B38.8,Outras Formas de Coccidioidomicose
B40.8,Outras Formas de Blastomicose
B41.8,Outras Formas de Paracoccidioidomicose
B42.8,Outras Formas de Esporotricose
B43.8,Outras Formas de Cromomicose
B44.8,Outras Formas de Aspergilose
B45.8,Outras Formas de Criptococose
B46.8,Outras Zigomicoses
B48.8,Outras Micoses Especificadas
B50.8,Outras Formas Graves e Complicadas de Malária Por Plasmodium Falciparum
B51.8,Malária Por Plasmodium Vivax Com Outras Complicações
B52.8,Malária Por Plasmodium Malariae Com Outras Complicações
B53.8,"Outras Formas de Malárias Com Confirmação Parasitológica, Não Classificadas em Outra Parte"
B58.8,Toxoplasmose Com Comprometimento de Outros Órgãos
B60.8,Outras Doenças Especificadas Devidas a Protozoários
B65.8,Outras Esquistossomoses
B66.8,Outras Infestações Por Trematódeos Especificados
B67.8,"Infestação Hepática Não Especificada, Por Echinococcus"
B69.8,Cisticercose de Outras Localizações
B71.8,Outras Infestações Especificadas Por Cestóides
B74.8,Outras Filarioses
B76.8,Outras Ancilostomíases
B77.8,Ascaridíase Com Outras Complicações
B81.8,Outras Helmintíases Intestinais Especificadas
B83.8,Outras Helmintíases Especificadas
B87.8,Miíase de Outras Localizações
B88.8,Outras Infestações Especificadas
B90.8,Seqüelas de Tuberculose de Outros Órgãos
B94.8,Seqüelas de Outras Doenças Infecciosas e Parasitárias Especificadas
B95.8,"Estafilococo Não Especificado, Como Causa de Doenças Classificadas em Outros Capítulos"
B96.8,"Outros Agentes Bacterianos Especificados, Como Causa de Doenças Classificadas em Outros Capítulos"
B97.8,"Outros Agentes Virais, Como Causa de Doenças Classificadas em Outros Capítulos"
C00.8,Neoplasia Maligna do Lábio Com Lesão Invasiva
C02.8,Neoplasia Maligna da Língua Com Lesão Invasiva
C04.8,Neoplasia Maligna do Assoalho da Boca Com Lesão Invasiva
C05.8,Neoplasia Maligna do Palato Com Lesão Invasiva
C06.8,Neoplasia Maligna de Outras Partes e de Partes Não Especificadas da Boca Com Lesão Invasiva
C08.8,Neoplasia Maligna Das Glândulas Salivares Maiores Com Lesão Invasiva
C09.8,Neoplasia Maligna da Amígdala Com Lesão Invasiva
C10.8,Neoplasia Maligna da Orofaringe Com Lesão Invasiva
C11.8,Neoplasia Maligna da Nasofaringe Com Lesão Invasiva
C13.8,Neoplasia Maligna da Hipofaringe Com Lesão Invasiva
C14.8,"Neoplasia Maligna do Lábio, Cavidade Oral e Faringe Com Lesão Invasiva"
C15.8,Neoplasia Maligna do Esôfago Com Lesão Invasiva
C16.8,Neoplasia Maligna do Estômago Com Lesão Invasiva
C17.8,Neoplasia Maligna do Intestino Delgado Com Lesão Invasiva
C18.8,Neoplasia Maligna do Cólon Com Lesão Invasiva
C21.8,"Neoplasia Maligna do Reto, Ânus e do Canal Anal Com Lesão Invasiva"
C24.8,Neoplasia Maligna Das Vias Biliares Com Lesão Invasiva
C25.8,Neoplasia Maligna do Pâncreas Com Lesão Invasiva
C26.8,Neoplasia Maligna do Aparelho Digestivo Com Lesão Invasiva
C31.8,Neoplasia Maligna Dos Seios da Face Com Lesão Invasiva
C32.8,Neoplasia Maligna da Laringe Com Lesão Invasiva
C34.8,Neoplasia Maligna Dos Brônquios e Dos Pulmões Com Lesão Invasiva
C38.8,"Neoplasia Maligna do Coração, Mediastino e Pleura Com Lesão Invasiva"
C39.8,Neoplasia Maligna do Aparelho Respiratório e Dos Órgãos Intratorácicos Com Lesão Invasiva
C40.8,Neoplasia Maligna Dos Ossos e Cartilagens Articulares Dos Membros Com Lesão Invasiva
C41.8,Neoplasia Maligna Dos Ossos e Das Cartilagens Articulares Com Lesão Invasiva
C43.8,Melanoma Maligno Invasivo da Pele
C44.8,Neoplasia Maligna da Pele Com Lesão Invasiva
C46.8,Sarcoma de Kaposi de Múltiplos Órgãos
C47.8,Neoplasia Maligna Dos Nervos Periféricos e do Sistema Nervoso Autônomo Com Lesão Invasiva
C48.8,Neoplasia Maligna Dos Tecidos Moles do Retroperitônio e do Peritônio Com Lesão Invasiva
C49.8,Neoplasia Maligna do Tecido Conjuntivo e Dos Tecidos Moles Com Lesão Invasiva
C50.8,Neoplasia Maligna da Mama Com Lesão Invasiva
C51.8,Neoplasia Maligna da Vulva Com Lesão Invasiva
C53.8,Neoplasia Maligna do Colo do Útero Com Lesão Invasiva
C54.8,Neoplasia Maligna do Corpo do Útero Com Lesão Invasiva
C57.8,Neoplasia Maligna Dos Órgãos Genitais Femininos Com Lesão Invasiva
C60.8,Neoplasia Maligna do Pênis Com Lesão Invasiva
C63.8,Neoplasia Maligna Dos Órgãos Genitais Masculinos Com Lesão Invasiva
C67.8,Neoplasia Maligna da Bexiga Com Lesão Invasiva
C68.8,Neoplasia Maligna Dos Órgãos Urinários Com Lesão Invasiva
C69.8,Neoplasia Maligna do Olho e Anexos Com Lesão Invasiva
C71.8,Neoplasia Maligna do Encéfalo Com Lesão Invasiva
C72.8,Neoplasia Maligna do Encéfalo e de Outras Partes do Sistema Nervoso Central Com Lesão Invasiva
C75.8,"Neoplasia Maligna Com Comprometimento Pluriglandular, Sem Outra Especificação"
C76.8,Neoplasia Maligna de Outras Localizações e Das Mal Definidas Com Lesão Invasiva
C77.8,Neoplasia Maligna Secundária e Não Especificada Dos Gânglios Linfáticos de Múltiplas Regiões
C78.8,Neoplasia Maligna Secundária de Outros Órgãos Digestivos e Não Especificados
C79.8,Neoplasia Maligna Secundária de Outra Localização Especificada
C83.8,Outros Tipos de Linfoma Não-Hodgkin Difuso
D03.8,Melanoma in Situ de Outras Localizações
D04.8,Carcinoma in Situ da Pele de Outras Localizações
D12.8,Neoplasia Benigna do Reto
D16.8,"Neoplasia Benigna Dos Ossos Pélvicos, Sacro e Cóccix"
D35.8,Neoplasia Benigna Com Comprometimento Pluriglandular
D44.8,Neoplasia de Comportamento Incerto ou Desconhecido Com Comprometimento Pluriglandular
D50.8,Outras Anemias Por Deficiência de Ferro
D51.8,Outras Anemias Por Deficiência de Vitamina B12
D52.8,Outras Anemias Por Deficiência de Folato
D53.8,Outras Anemias Nutricionais Especificadas
D55.8,Outras Anemias Devidas a Transtornos Enzimáticos
D56.8,Outras Talassemias
D57.8,Outros Transtornos Falciformes
D58.8,Outras Anemias Hemolíticas Hereditárias Especificadas
D59.8,Outras Anemias Hemolíticas Adquiridas
D60.8,Outras Aplasias Puras Adquiridas da Série Vermelha
D61.8,Outras Anemias Aplásticas Especificadas
D63.8,Anemia em Outras Doenças Classificadas em Outra Parte
D64.8,Outras Anemias Especificadas
D68.8,Outros Defeitos Especificados da Coagulação
D69.8,Outras Afecções Hemorrágicas Especificadas
D72.8,Outros Transtornos Especificados Dos Glóbulos Brancos
D73.8,Outras Doenças do Baço
D74.8,Outras Metemoglobinemias
D75.8,Outras Doenças Especificadas do Sangue e Dos Órgãos Hematopoéticos
D80.8,Outras Imunodeficiências Com Predominância de Defeitos de Anticorpos
D81.8,Outras Deficiências Imunitárias Combinadas
D82.8,"""Imunodeficiências Associadas Com Outros Defeitos """"major"""" Especificados"""
D83.8,Outras Imunodeficiências Comuns Variáveis
D84.8,Outras Imunodeficiências Especificadas
D86.8,Sarcoidose de Outros Locais Especificados e Locais Combinados
D89.8,Outros Transtornos Especificados Que Comprometem o Mecanismo Imunitário Não Classificados em Outra Parte
E01.8,"Outros Transtornos Tireoidianos e Afecções Associadas, Relacionados Com a Deficiência de Iodo"
E03.8,Outros Hipotireoidismos Especificados
E04.8,Outro Bócio Não-tóxico Especificado
E05.8,Outras Tireotoxicoses
E07.8,Outros Transtornos Especificados da Tireóide
E10.8,Diabetes Mellitus Insulino-dependente - Com Complicações Não Especificadas
E11.8,Diabetes Mellitus Não-insulino-dependente - Com Complicações Não Especificadas
E12.8,Diabetes Mellitus Relacionado Com a Desnutrição - Com Complicações Não Especificadas
E13.8,Outros Tipos Especificados de Diabetes Mellitus - Com Complicações Não Especificadas
E14.8,Diabetes Mellitus Não Especificado - Com Complicações Não Especificadas
E16.8,Outros Transtornos Especificados da Secreção Pancreática Interna
E20.8,Outro Hipoparatireoidismo
E22.8,Outras Hiperfunções da Hipófise
E24.8,Outra Síndrome de Cushing
E25.8,Outros Transtornos Adrenogenitais
E26.8,Outro Hiperaldosteronismo
E27.8,Outros Transtornos Especificados da Supra-renal
E28.8,Outra Disfunção Ovariana
E29.8,Outra Disfunção Testicular
E30.8,Outros Transtornos da Puberdade
E31.8,Outra Disfunção Poliglandular
E32.8,Outras Doenças do Timo
E34.8,Outros Transtornos Endócrinos Especificados
E35.8,Transtornos de Outras Glândulas Endócrinas em Doenças Classificadas em Outra Parte
E50.8,Outras Manifestações Devidas a Deficiência de Vitamina A
E51.8,Outras Manifestações da Deficiência de Tiamina
E53.8,Deficiência de Outras Vitaminas Especificadas do Grupo B
E56.8,Deficiência de Outras Vitaminas
E61.8,Deficiência de Outros Elementos Nutrientes Especificados
E63.8,Outras Deficiências Nutricionais Especificadas
E64.8,Seqüelas de Outras Deficiências Nutricionais
E66.8,Outra Obesidade
E67.8,Outras Formas Especificadas de Hiperalimentação
E70.8,Outros Distúrbios do Metabolismo de Aminoácidos Aromáticos
E72.8,Outros Distúrbios Especificados do Metabolismo Dos Aminoácidos
E73.8,Outras Intolerâncias à Lactose
E74.8,Outros Distúrbios Especificados do Metabolismo de Carboidratos
E76.8,Outros Distúrbios do Metabolismo do Glicosaminoglicano
E77.8,Outros Distúrbios do Metabolismo de Glicoproteínas
E78.8,Outros Distúrbios do Metabolismo de Lipoproteínas
E79.8,Outros Distúrbios do Metabolismo da Purina e Pirimidina
E83.8,Outros Distúrbios do Metabolismo Mineral
E84.8,Fibrose Cística Com Outras Manifestações
E85.8,Outras Amiloidoses
E87.8,Outros Transtornos do Equilíbrio Hidroeletrolítico Não Classificados em Outra Parte
E88.8,Outros Distúrbios Especificados do Metabolismo
E89.8,Outros Transtornos Endócrinos e Metabólicos Pós-procedimento
F01.8,Outra Demência Vascular
F02.8,Demência em Outras Doenças Especificadas Classificadas em Outra Parte
F05.8,Outro Delirium
F06.8,Outros Transtornos Mentais Especificados Devidos a Uma Lesão e Disfunção Cerebral e a Uma Doença Física
F07.8,"Outros Transtornos Orgânicos da Personalidade e do Comportamento Devidos a Doença Cerebral, Lesão e Disfunção"
F10.8,Transtornos Mentais e Comportamentais Devidos ao Uso de Álcool - Outros Transtornos Mentais ou Comportamentais
F11.8,Transtornos Mentais e Comportamentais Devidos ao Uso de Opiáceos - Outros Transtornos Mentais ou Comportamentais
F12.8,Transtornos Mentais e Comportamentais Devidos ao Uso de Canabinóides - Outros Transtornos Mentais ou Comportamentais
F13.8,Transtornos Mentais e Comportamentais Devidos ao Uso de Sedativos e Hipnóticos - Outros Transtornos Mentais ou Comportamentais
F14.8,Transtornos Mentais e Comportamentais Devidos ao Uso da Cocaína - Outros Transtornos Mentais ou Comportamentais
F15.8,"Transtornos Mentais e Comportamentais Devidos ao Uso de Outros Estimulantes, Inclusive a Cafeína - Outros Transtornos Mentais ou Comportamentais"
F16.8,Transtornos Mentais e Comportamentais Devidos ao Uso de Alucinógenos - Outros Transtornos Mentais ou Comportamentais
F17.8,Transtornos Mentais e Comportamentais Devidos ao Uso de Fumo - Outros Transtornos Mentais ou Comportamentais
F18.8,Transtornos Mentais e Comportamentais Devidos ao Uso de Solventes Voláteis - Outros Transtornos Mentais ou Comportamentais
F19.8,Transtornos Mentais e Comportamentais Devidos ao Uso de Múltiplas Drogas e ao Uso de Outras Substâncias Psicoativas - Outros Transtornos Mentais ou Comportamentais
F20.8,Outras Esquizofrenias
F22.8,Outros Transtornos Delirantes Persistentes
F23.8,Outros Transtornos Psicóticos Agudos e Transitórios
F25.8,Outros Transtornos Esquizoafetivos
F30.8,Outros Episódios Maníacos
F31.8,Outros Transtornos Afetivos Bipolares
F32.8,Outros Episódios Depressivos
F33.8,Outros Transtornos Depressivos Recorrentes
F34.8,Outros Transtornos do Humor (afetivos) Persistentes
F38.8,Outros Transtornos Especificados do Humor (afetivos)
F40.8,Outros Transtornos Fóbico-ansiosos
F41.8,Outros Transtornos Ansiosos Especificados
F42.8,Outros Transtornos Obsessivo-compulsivos
F43.8,"""Outras Reações ao """"stress"""" Grave"""
F44.8,Outros Transtornos Dissociativos (de Conversão)
F45.8,Outros Transtornos Somatoformes
F48.8,Outros Transtornos Neuróticos Especificados
F50.8,Outros Transtornos da Alimentação
F51.8,Outros Transtornos do Sono Devidos a Fatores Não-orgânicos
F52.8,Outras Disfunções Sexuais Não Devidas a Transtorno ou à Doença Orgânica
F53.8,Outros Transtornos Mentais e Comportamentais Associados ao Puerpério Não Classificados em Outra Parte
F60.8,Outros Transtornos Específicos da Personalidade
F62.8,Outras Modificações Duradouras da Personalidade
F63.8,Outros Transtornos Dos Hábitos e Dos Impulsos
F64.8,Outros Transtornos da Identidade Sexual
F65.8,Outros Transtornos da Preferência Sexual
F66.8,Outros Transtornos do Desenvolvimento Psicossexual
F68.8,Outros Transtornos Especificados da Personalidade e do Comportamento do Adulto
F70.8,Retardo Mental Leve - Outros Comprometimentos do Comportamento
F71.8,Retardo Mental Moderado - Outros Comprometimentos do Comportamento
F72.8,Retardo Mental Grave - Outros Comprometimentos do Comportamento
F73.8,Retardo Mental Profundo - Outros Comprometimentos do Comportamento
F78.8,Outro Retardo Mental - Outros Comprometimentos do Comportamento
F79.8,Retardo Mental Não Especificado - Outros Comprometimentos do Comportamento
F80.8,Outros Transtornos de Desenvolvimento da Fala ou da Linguagem
F81.8,Outros Transtornos do Desenvolvimento Das Habilidades Escolares
F84.8,Outros Transtornos Globais do Desenvolvimento
F90.8,Outros Transtornos Hipercinéticos
F91.8,Outros Transtornos de Conduta
F92.8,Outros Transtornos Mistos da Conduta e Das Emoções
F93.8,Outros Transtornos Emocionais da Infância
F94.8,Outros Transtornos do Funcionamento Social na Infância
F95.8,Outros Tiques
F98.8,Outros Transtornos Comportamentais e Emocionais Especificados Com Início Habitualmente na Infância ou Adolescência
G00.8,Outras Meningites Bacterianas
G02.8,Meningite em Outras Doenças Infecciosas e Parasitárias Classificadas em Outra Parte
G03.8,Meningite Devida a Outras Causas Especificadas
G04.8,"Outras Encefalites, Mielites e Encefalomielites"
G05.8,"Encefalite, Mielite e Encefalomielite em Outras Doenças Classificadas em Outra Parte"
G11.8,Outras Ataxias Hereditárias
G12.8,Outras Atrofias Musculares Espinais e Síndromes Musculares Correlatas
G13.8,Atrofia Sistêmica Que Afeta Primariamente o Sistema Nervoso Central em Outras Doenças Classificadas em Outra Parte
G21.8,Outras Formas de Parkinsonismo Secundário
G23.8,Outras Doenças Degenerativas Especificadas Dos Gânglios da Base
G24.8,Outras Distonias
G25.8,"Outras Doenças Extrapiramidais e Transtornos Dos Movimentos, Especificados"
G30.8,Outras Formas de Doença de Alzheimer
G31.8,Outras Doenças Degenerativas Especificadas do Sistema Nervoso
G32.8,Outros Transtornos Degenerativos Especificados do Sistema Nervoso em Doenças Classificadas em Outra Parte
G36.8,Outras Desmielinizações Disseminadas Agudas Especificadas
G37.8,Outras Doenças Desmielinizantes Especificadas do Sistema Nervoso Central
G40.8,Outras Epilepsias
G41.8,Outros Estados de Mal Epiléptico
G43.8,Outras Formas de Enxaqueca
G44.8,Outras Síndromes de Cefaléia Especificadas
G45.8,Outros Acidentes Isquêmicos Cerebrais Transitórios e Síndromes Correlatas
G46.8,Outras Síndromes Vasculares Cerebrais em Doenças Cerebrovasculares
G47.8,Outros Distúrbios do Sono
G50.8,Outros Transtornos do Nervo Trigêmeo
G51.8,Outros Transtornos do Nervo Facial
G52.8,Transtornos de Outros Nervos Cranianos Especificados
G53.8,Outros Transtornos de Nervos Cranianos em Outras Doenças Classificadas em Outra Parte
G54.8,Outros Transtornos Das Raízes e Dos Plexos Nervosos
G55.8,Compressões Das Raízes e Dos Plexos Nervosos em Outras Doenças Classificadas em Outra Parte
G56.8,Outras Mononeuropatias Dos Membros Superiores
G57.8,Outras Mononeuropatias Dos Membros Inferiores
G58.8,Outras Mononeuropatias Especificadas
G59.8,Outras Mononeuropatias em Doenças Classificadas em Outra Parte
G60.8,Outras Neuropatias Hereditárias e Idiopáticas
G61.8,Outras Polineuropatias Inflamatórias
G62.8,Outras Polineuropatias Especificadas
G63.8,Polineuropatia em Outras Doenças Classificadas em Outra Parte
G70.8,Outros Transtornos Mioneurais Especificados
G71.8,Outros Transtornos Primários Dos Músculos
G72.8,Outras Miopatias Especificadas
G80.8,Outras Formas de Paralisia Cerebral
G83.8,Outras Síndromes Paralíticas Especificadas
G90.8,Outros Transtornos do Sistema Nervoso Autônomo
G91.8,Outras Formas de Hidrocefalia
G93.8,Outros Transtornos Especificados do Encéfalo
G94.8,Outros Transtornos Encefálicos Especificados em Doenças Classificadas em Outra Parte
G95.8,Outras Doenças Especificadas da Medula Espinal
G96.8,Outros Transtornos Especificados do Sistema Nervoso Central
G97.8,Outros Transtornos Pós-procedimento do Sistema Nervoso
G99.8,Outros Transtornos Especificados do Sistema Nervoso em Doenças Classificadas em Outra Parte
H01.8,Outras Inflamações Especificadas da Pálpebra
H02.8,Outros Transtornos Especificados Das Pálpebras
H03.8,Comprometimento da Pálpebra em Outras Doenças Classificadas em Outras Partes
H04.8,Outros Transtornos do Aparelho Lacrimal
H05.8,Outros Transtornos da Órbita
H10.8,Outras Conjuntivites
